Key,Item Type,Publication Year,Author,Title,Publication Title,ISBN,ISSN,DOI,Url,Abstract Note,Date,Date Added,Date Modified,Access Date,Pages,Num Pages,Issue,Volume,Number Of Volumes,Journal Abbreviation,Short Title,Series,Series Number,Series Text,Series Title,Publisher,Place,Language,Rights,Type,Archive,Archive Location,Library Catalog,Call Number,Extra,Notes,File Attachments,Link Attachments,Manual Tags,Automatic Tags,Editor,Series Editor,Translator,Contributor,Attorney Agent,Book Author,Cast Member,Commenter,Composer,Cosponsor,Counsel,Interviewer,Producer,Recipient,Reviewed Author,Scriptwriter,Words By,Guest,Number,Edition,Running Time,Scale,Medium,Artwork Size,Filing Date,Application Number,Assignee,Issuing Authority,Country,Meeting Name,Conference Name,Court,References,Reporter,Legal Status,Priority Numbers,Programming Language,Version,System,Code,Code Number,Section,Session,Committee,History,Legislative Body
QNVGASHR,journalArticle,2018,"Rawn, Catherine D; Fox, Joanne A",Understanding the Work and Perceptions of Teaching Focused Faculty in a Changing Academic Landscape,Research in Higher Education,nan,0361-0365,101007s11162-017-9479-6,nan,"Teaching Focused Faculty TFF roles are growing across Canada and around the world, raising questions about how to understand the nature of faculty work and how faculty in non-traditional work distributions feel about their work Our study is the first attempt to survey TFF members' work and job attitudes at large research intensive universities in Canada Our data contribute to the literature on the nature of faculty work, by revealing that TFF engage in a wide variety of work, including teaching, service, curriculum leadership, and often research in pedagogy andor disciplines TFF report mixed messages about what their departments and institutions expect of them Our data also contribute to the literature on how faculty feel about their work Consistent with other research on faculty job attitudes, TFF report valuing their jobs highly Our data also reveal that feeling integrated into mainstream institutional culture is a particularly important contributor to this sense of value Taken together, our findings can be used to inform the research literature on faculty work, as well as by administrators seeing to implement or enhance TFF ranks at their institutions; To access, purchase, authenticate, or subscribe to the full-text of this article, please visit this link httpdxdoiorg101007s11162-017-9479-6",2018,2024-01-25 221414,2024-02-02 210607,nan,591-622,nan,5,590,nan,nan,nan,nan,nan,nan,nan,nan,nan,English,nan,nan,nan,nan,nan,nan,nan,nan,nan,nan,Professional Development; Michael Smith Laboratories,nan,nan,nan,nan,nan,nan,nan,nan,nan,nan,nan,nan,nan,nan,nan,nan,nan,nan,nan,nan,nan,nan,nan,nan,nan,nan,nan,nan,nan,nan,nan,nan,nan,nan,nan,nan,nan,nan,nan,nan,nan,nan,nan,nan,nan,nan,nan
665FGGSQ,journalArticle,2022,"Algar, W Russ; Elouazizi, Noureddine; Stewart, Jaclyn J; Maxwell, E Jane; Tan, Tanya; Zhang, Zuxing; Stoodley, Robin; Rodríguez Núñez, José R; Terpstra, Andrea S; Wickenden, Jason G","The Alchemy Project A Personalized, Flexible, and Scalable Active Learning Platform to Help Foster Expert-Like Thinking in Chemistry",Journal of Chemical Education,nan,0021-9584,101021acsjchemed2c00097,httpsdoiorg101021acsjchemed2c00097,"To develop expertise, novice chemistry students require deliberate practice with immediate and thoughtful feedback Whereas opportunities for practice are often abundant, opportunities for feedback tend to be much scarcer To address this challenge, we collaborated with students to develop a flexible and scalable online platform called Alchemy Students interact with the software through a series of prompts and multiple-choice questions, receiving targeted feedback at each step Each student can navigate a scenario differently, influenced by their prior knowledge and misconceptions In design, scenarios are instructor-created graphs that model their expert-level thought processes and teaching experience This graph format is a distinct and advantageous feature of Alchemy that supports linear, nonlinear, and cyclical progression through a concept or problem Alchemy-based homework has been assigned in lecture and lab courses, at the sophomore and junior levels, with enrollments ranging from many tens to many hundreds of students Approximately 80 of students rated Alchemy as veryextremely helpful to their learning, emphasizing the value of the step-by-step process and feedback Alchemy is discussed in the contexts of other software platforms, its advantages and limitations, lessons learned in its initial deployments, and future directions for its development and usage",2022-09-13,2024-01-25 221439,2024-02-02 210315,2023-12-21 185328,3104-3113,nan,9,990,nan,J Chem Educ,The Alchemy Project,nan,nan,nan,nan,nan,nan,nan,nan,nan,nan,nan,ACS Publications,nan,Publisher American Chemical Society,nan,"UsersivancheungZoterostorage4SXERAFCAlgar et al - 2022 - The Alchemy Project A Personalized, Flexible, andpdf",nan,Undergraduate Students; Chemistry; Teaching Resources Digital Other; Science Centre for Learning and Teaching Skylight; Online Learning,nan,nan,nan,nan,nan,nan,nan,nan,nan,nan,nan,nan,nan,nan,nan,nan,nan,nan,nan,nan,nan,nan,nan,nan,nan,nan,nan,nan,nan,nan,nan,nan,nan,nan,nan,nan,nan,nan,nan,nan,nan,nan,nan,nan,nan,nan,nan
9J8R9J9H,conferencePaper,2012,"Patitsas, Elizabeth; Belleville, Patrice",What can we learn from quantitative teaching assistant evaluations,Proceedings of the Seventeenth Western Canadian Conference on computing education,nan,nan,10114522475692247582,nan,"The teaching assistant plays an important role in teaching computer science at large research-intensive universities We conducted an exploratory study examining what quantitative teaching evaluations can tell us about our TAs We found that evaluations were highly coarse-grained students did not differentiate between the different criteria in the evaluations, and that TAs working in pairs were evaluated as one unit We found that poor TA evaluations were negatively correlated to student retention We also found that TAs teaching more than three lab sections a week had lower evaluations Finally, we found no correlation between TA evaluations and TA experience, students' final grades, and TA gender We note that quantitative evaluations paint an incomplete picture of TAs' performance, and that more work is needed to provide TAs with formative assessment",2012,2024-01-25 221414,2024-04-16 163814,nan,36-40,nan,nan,00,nan,nan,nan,nan,nan,nan,nan,nan,nan,English,nan,nan,nan,nan,nan,nan,nan,nan,nan,nan,Computer Science; Teaching Assistants; Student Satisfaction,nan,nan,nan,nan,nan,nan,nan,nan,nan,nan,nan,nan,nan,nan,nan,nan,nan,nan,nan,nan,nan,nan,nan,nan,nan,nan,nan,nan,nan,nan,nan,nan,nan,nan,nan,nan,nan,nan,nan,nan,nan,nan,nan,nan,nan,nan,nan
GNPGFCSK,journalArticle,2021,"Ferrara, Joseph D; Bates, Simon; Cochran, Amanda; Del Campo, Mark; Goeb, Christian R; Kleemiss, Florian; Le Magueres, Pierre; Lengyel, Jeff; Meyer, Mathias; Puschmann, Horst; Saito, Keisuke; Schuermann, Christian; Stanley, Alexandra; Swepston, Paul N; White, Fraser; Wojciechowski, Jakub",Using Zoom Webinar to Teach Advanced Topics in Crystallography,ACTA CRYSTALLOGRAPHICA A-FOUNDATION AND ADVANCES,nan,2053-2733,nan,httpswwwncbinlmnihgovpmcarticlesPMC7910006,nan,2021-08,2024-01-25 221439,2024-04-25 173358,2024-01-15 220021,C678-C678,nan,nan,770,nan,Acta Crystallogr Sect A,nan,nan,nan,nan,nan,nan,nan,English,nan,nan,nan,nan,Clarivate Analytics Web of Science,nan,Num Pages 1 Place Chester Publisher Int Union Crystallography Web of Science ID WOS000761714400657,nan,nan,nan,Online Teaching; Physics and Astronomy; Teaching Resources Digital Other,nan,nan,nan,nan,nan,nan,nan,nan,nan,nan,nan,nan,nan,nan,nan,nan,nan,nan,nan,nan,nan,nan,nan,nan,nan,nan,nan,nan,nan,nan,nan,nan,nan,nan,nan,nan,nan,nan,nan,nan,nan,nan,nan,nan,nan,nan,nan
LE59RUWA,journalArticle,2013,"Johnson, Olivia; Hancock, Sally; Galloway, Ross; Wallace, Marsali; Bates, Simon; Draper, Steve",Fostering Learning Improvements in Physics FLIP projects A status report,New Directions Higher Education Academy,nan,nan,1011120ndir201300001,httpswwwresearchgatenetpublication273646435_Fostering_Learning_Improvements_in_Physics_FLIP_project_A_status_report,"The Fostering Learning Improvements in Physics project is examining the international status of subject-based educational research in physics and the potential for work in this field to impact the teaching and learning of undergraduate physics in UK universities While focused specifically on physics, outcomes of the project may be relevant to subject-based educational research and to teaching and learning within the physical sciences more generally We report on the aims, approaches and current status at the mid-point of this one-year study ABSTRACT FROM AUTHOR",2013,2024-01-25 221414,2024-04-24 231754,nan,60-65,nan,1,90,nan,nan,nan,nan,nan,nan,nan,nan,nan,nan,nan,nan,nan,nan,nan,nan,nan,nan,nan,httpezproxylibraryubccaloginurlhttpsearchebscohostcomloginaspxdirecttruedbeueAN93299923siteehost-livescopesite,Physics and Astronomy,nan,nan,nan,nan,nan,nan,nan,nan,nan,nan,nan,nan,nan,nan,nan,nan,nan,nan,nan,nan,nan,nan,nan,nan,nan,nan,nan,nan,nan,nan,nan,nan,nan,nan,nan,nan,nan,nan,nan,nan,nan,nan,nan,nan,nan,nan,nan
KJ2HN5S9,journalArticle,2013,"Bates, Simon","Different Perspective, Same Challenges",New Directions Higher Education Academy,nan,nan,1029311ndtpsv0i9478,httpsjournalsleacukojs1indexphpnew-directionsarticleview478,"I present a perspective on one of the most important challenges facing teaching and learning, in the Physical Sciences and many other disciplines I argue that the challenge is less about finding novel ways to enhance student learning but ensuring a wider and more rapid take up of evidence-based approaches that have been convincingly shown through research studies to be effective in creating conditions for successful learning I offer some advice to those engaged in supporting teaching and learning, from academic staff at the coalface, to institutional leaders and the HEA ABSTRACT FROM AUTHOR",2013,2024-01-25 221414,2024-04-24 195250,nan,1-3,nan,1,90,nan,nan,nan,nan,nan,nan,nan,nan,nan,nan,nan,nan,nan,nan,nan,nan,nan,nan,nan,httpezproxylibraryubccaloginurlhttpsearchebscohostcomloginaspxdirecttruedbeueAN93299929siteehost-livescopesite,Physics and Astronomy,nan,nan,nan,nan,nan,nan,nan,nan,nan,nan,nan,nan,nan,nan,nan,nan,nan,nan,nan,nan,nan,nan,nan,nan,nan,nan,nan,nan,nan,nan,nan,nan,nan,nan,nan,nan,nan,nan,nan,nan,nan,nan,nan,nan,nan,nan,nan
BW3W2Q7S,conferencePaper,2011,"Acton, Donald",What does 50 mean,Proceedings of the 16th Western Canadian Conference on computing education,nan,nan,10114519896221989636,nan,"In this paper, we describe the changes from a norm based assessment scheme to a criterion based one in a large second year programming course with a heterogeneous student population The changes were prompted by two observations One was that many students were reporting that the course and assignments were too easy while others were reporting the opposite The second observation was that the results of some final exam BRACElet questions indicated that students weren't mastering some key areas of the course This paper describes the modifications to the existing course grading scheme, the rationale for the changes, and the results of the changes in an attempt to address the concerns",2011,2024-01-25 221414,2024-04-16 164125,nan,47-51,nan,nan,00,nan,nan,nan,nan,nan,nan,nan,nan,nan,English,nan,nan,nan,nan,nan,nan,nan,nan,nan,nan,Computer Science; Alternative Assessment,nan,nan,nan,nan,nan,nan,nan,nan,nan,nan,nan,nan,nan,nan,nan,nan,nan,nan,nan,nan,nan,nan,nan,nan,nan,nan,nan,nan,nan,nan,nan,nan,nan,nan,nan,nan,nan,nan,nan,nan,nan,nan,nan,nan,nan,nan,nan
VNSRKYHR,conferencePaper,2021,"Hall, Braxton; Heyl, Noa; Baniassad, Elisa; Allen, Meghan; Holmes, Reid",The efficacy of online office hours an experience report,Proceedings of the 2021 ACM SIGPLAN International Symposium on SPLASH-E,978-1-4503-9089-7,nan,10114534842723484966,httpsdoiorg10114534842723484966,"To facilitate assisting students while online during the COVID 19 pandemic, we transitioned to online office hours These were managed by an automated queue which kept track of who was waiting in office hours, and for how long We combined data about office hour usage with students' project commit and grade history These data afforded us a unique look at the efficacy of office hours that the usual, casual drop-in style office hours, did not allow Amongst other findings, we saw that while individual office hours visits did increase student grades, more visits during the term was negatively correlated with the final project outcome",2021-10-17,2024-01-25 221439,2024-02-02 202615,2023-12-04,5964,nan,nan,nan,nan,nan,The efficacy of online office hours,SPLASH-E 2021,nan,nan,nan,Association for Computing Machinery,"New York, NY, USA",nan,nan,nan,nan,nan,ACM Digital Library,nan,nan,nan,nan,nan,Computer Science; Student Performance; Online Teaching; Online Learning,nan,nan,nan,nan,nan,nan,nan,nan,nan,nan,nan,nan,nan,nan,nan,nan,nan,nan,nan,nan,nan,nan,nan,nan,nan,nan,nan,nan,nan,nan,nan,nan,nan,nan,nan,nan,nan,nan,nan,nan,nan,nan,nan,nan,nan,nan,nan
WPABEKGY,journalArticle,2017,"McLaughlin, Jacqueline; Favre, David; Weinstein, Suzanne; Goedhart, Christine","The Impact of a Four-Step Laboratory Pedagogical Framework on Biology Students' Perceptions of Laboratory Skills, Knowledge, and Interest in Research",Journal of college science teaching,nan,nan,1025054jcst17_047_01_83,nan,"Authentic undergraduate research laboratory experiences are essential to aid in the implementation of science education reform mandates and to effectively train a new generation of biology students Here we present assessment data on a unique four-step laboratory pedagogical framework that allows students to develop scientific thinking and practices while authentically engaging in the scientific process This framework was used to transform a sophomore-level introductory biology laboratory course for biology majors at a 4-year college and an honors introductory biology laboratory course for nonmajors at a 2-year college The goal of each transformation was to provide students with the opportunity to experience research in the manner in which professional research scientists conduct it through devising, designing, executing, interpreting, and communicating their experimental results Student responses to the assessments used in this study showed improvements in 4-year and 2-year college students' perceptions of their laboratory skills and knowledge, and 2-year college students' interest in doing further research in the laboratory The simplicity and flexibility involved in the four-step model allows it to be easily adopted for use across multiple institutional contexts and levels of biological study",2017-09-01,2024-01-25 221439,2024-02-02 201000,nan,nan,nan,nan,830,nan,Journal of college science teaching,nan,nan,nan,nan,nan,nan,nan,nan,nan,nan,nan,nan,ResearchGate,nan,nan,nan,UsersivancheungZoterostorageKRPND8AGMcLaughlin et al - 2017 - The Impact of a Four-Step Laboratory Pedagogical Fpdf; ,httpswwwresearchgatenetprofileJacqueline-Mclaughlinpublication319493438_The_Impact_of_a_Four-Step_Laboratory_Pedagogical_Framework_on_Biology_Students'_Perceptions_of_Laboratory_Skills_Knowledge_and_Interest_in_Researchlinks59aef518aca2720370735c94The-Impact-of-a-Four-Step-Laboratory-Pedagogical-Framework-on-Biology-Students-Perceptions-of-Laboratory-Skills-Knowledge-and-Interest-in-Researchpdf,Undergraduate Research; Introductory Courses; Research Experience; Lab Course; Student Performance; Science Centre for Learning and Teaching Skylight,nan,nan,nan,nan,nan,nan,nan,nan,nan,nan,nan,nan,nan,nan,nan,nan,nan,nan,nan,nan,nan,nan,nan,nan,nan,nan,nan,nan,nan,nan,nan,nan,nan,nan,nan,nan,nan,nan,nan,nan,nan,nan,nan,nan,nan,nan,nan
STMF8LT2,journalArticle,2021,"Seo, Kyoungwon; Tang, Joice; Roll, Ido; Fels, Sidney; Yoon, Dongwook",The impact of artificial intelligence on learnerinstructor interaction in online learning,International Journal of Educational Technology in Higher Education,nan,2365-9440,101186s41239-021-00292-9,httpsdoiorg101186s41239-021-00292-9,"Artificial intelligence AI systems offer effective support for online learning and teaching, including personalizing learning for students, automating instructors routine tasks, and powering adaptive assessments However, while the opportunities for AI are promising, the impact of AI systems on the culture of, norms in, and expectations about interactions between students and instructors are still elusive In online learning, learnerinstructor interaction inter alia, communication, support, and presence has a profound impact on students satisfaction and learning outcomes Thus, identifying how students and instructors perceive the impact of AI systems on their interaction is important to identify any gaps, challenges, or barriers preventing AI systems from achieving their intended potential and risking the safety of these interactions To address this need for forward-looking decisions, we used Speed Dating with storyboards to analyze the authentic voices of 12 students and 11 instructors on diverse use cases of possible AI systems in online learning Findings show that participants envision adopting AI systems in online learning can enable personalized learnerinstructor interaction at scale but at the risk of violating social boundaries Although AI systems have been positively recognized for improving the quantity and quality of communication, for providing just-in-time, personalized support for large-scale settings, and for improving the feeling of connection, there were concerns about responsibility, agency, and surveillance issues These findings have implications for the design of AI systems to ensure explainability, human-in-the-loop, and careful data collection and presentation Overall, contributions of this study include the design of AI system storyboards which are technically feasible and positively support learnerinstructor interaction, capturing students and instructors concerns of AI systems through Speed Dating, and suggesting practical implications for maximizing the positive impact of AI systems while minimizing the negative ones",2021-10-26,2024-01-25 221439,2024-02-02 200815,2023-12-08 234640,54,nan,1,180,nan,International Journal of Educational Technology in Higher Education,nan,nan,nan,nan,nan,nan,nan,nan,nan,nan,nan,nan,BioMed Central,nan,nan,nan,UsersivancheungZoterostorageCD6E6SVJSeo et al - 2021 - The impact of artificial intelligence on learneripdf,nan,Computer Science; Engagement; Personalized Learning; Alternative Assessment; Online Learning,nan,nan,nan,nan,nan,nan,nan,nan,nan,nan,nan,nan,nan,nan,nan,nan,nan,nan,nan,nan,nan,nan,nan,nan,nan,nan,nan,nan,nan,nan,nan,nan,nan,nan,nan,nan,nan,nan,nan,nan,nan,nan,nan,nan,nan,nan,nan
E2I8UM6E,journalArticle,2016,"Code, Warren; Merchant, Sandra; Maciejewski, Wes; Thomas, Matthew; Lo, Joseph",The Mathematics Attitudes and Perceptions Survey an instrument to assess expert-like views and dispositions among undergraduate mathematics students,International Journal of Mathematical Education in Science and Technology,nan,0020-739X,1010800020739X20151133854,nan,"One goal of an undergraduate education in mathematics is to help students develop a productive disposition towards mathematics A way of conceiving of this is as helping mathematical novices transition to more expert-like perceptions of mathematics This conceptualization creates a need for a way to characterize students' perceptions of mathematics in authentic educational settings This article presents a survey, the Mathematics Attitudes and Perceptions Survey MAPS, designed to address this need We present the development of the MAPS instrument and its validation on a large N  3411 set of student data Results from various MAPS implementations corroborate results from analogous instruments in other STEM disciplines We present these results and highlight some in particular MAPS scores correlate with course grades; students tend to move away from expert-like orientations over a semester or year of taking a mathematics course; and interactive-engagement type lectures have less of a negative impact, but no positive impact, on students' overall orientations than traditional lecturing We include the MAPS instrument in this article and suggest ways in which it may deepen our understanding of undergraduate mathematics education",2016,2024-01-25 221414,2024-02-02 195130,nan,917-937,nan,6,470,nan,nan,nan,nan,nan,nan,nan,nan,nan,English,nan,nan,nan,nan,nan,nan,nan,nan,UsersivancheungZoterostorageG4GTT5DCCode et al - 2016 - The Mathematics Attitudes and Perceptions Survey pdf,nan,Undergraduate Students; Student Attitudes; Science Centre for Learning and Teaching Skylight,nan,nan,nan,nan,nan,nan,nan,nan,nan,nan,nan,nan,nan,nan,nan,nan,nan,nan,nan,nan,nan,nan,nan,nan,nan,nan,nan,nan,nan,nan,nan,nan,nan,nan,nan,nan,nan,nan,nan,nan,nan,nan,nan,nan,nan,nan,nan
WKBS357D,journalArticle,2021,"Strubbe, Linda; Okere, Bonaventure I; Zhang, Jielai; Chibueze, James O; Ikape, Margaret; Okouma, Patrice M; Ibik, Adaeze; White, Heidi; Abotsi-Masters, Sarah; Man, Allison; Webb, Sara",The Pan-African School for Emerging Astronomers,Nature Astronomy,nan,2397-3366,101038s41550-021-01301-7,httpswwwnaturecomarticless41550-021-01301-7,"The Pan-African School for Emerging Astronomers PASEA is an innovative short course for African university students, held by an African-led international collaboration PASEA aims to build a critical mass of astronomers in Africa and exchange ideas about teaching across continents",2021-03,2024-01-25 221439,2024-02-02 194614,2023-12-06 004753,217-220,nan,3,50,nan,Nat Astron,nan,nan,nan,nan,nan,nan,nan,en,2021 Springer Nature Limited,nan,nan,nan,wwwnaturecom,nan,Number 3 Publisher Nature Publishing Group,nan,nan,nan,Teaching Practices; Physics and Astronomy,nan,nan,nan,nan,nan,nan,nan,nan,nan,nan,nan,nan,nan,nan,nan,nan,nan,nan,nan,nan,nan,nan,nan,nan,nan,nan,nan,nan,nan,nan,nan,nan,nan,nan,nan,nan,nan,nan,nan,nan,nan,nan,nan,nan,nan,nan,nan
TVV4EFQ5,journalArticle,2017,"Baskin, Sami; Iscan, Adem; Karagoz, Beytullah; Birol, Gülnur",The use of vocabulary learning strategies in teaching Turkish as a second language,Journal of education and practice,nan,nan,nan,httpsericedgovidEJ1138831,nan,2017,2024-01-25 221439,2024-02-02 193142,2024-01-25 000628,126134,nan,9,80,nan,nan,nan,nan,nan,nan,nan,nan,nan,nan,nan,nan,nan,nan,Google Scholar,nan,Publisher ERIC,nan,UsersivancheungZoterostorageKAQUADK3Baskin et al - 2017 - The use of vocabulary learning strategies in teachpdf,nan,Learning Strategies; Science Centre for Learning and Teaching Skylight,nan,nan,nan,nan,nan,nan,nan,nan,nan,nan,nan,nan,nan,nan,nan,nan,nan,nan,nan,nan,nan,nan,nan,nan,nan,nan,nan,nan,nan,nan,nan,nan,nan,nan,nan,nan,nan,nan,nan,nan,nan,nan,nan,nan,nan,nan,nan
ZAXWPIZC,bookSection,2020,"Greenhoot, Andrea Follmer; Aslan, Carolyn; Chasteen, Stephanie; Code, Warren; Sherman, Sarah Bean",Variations on Embedded Expert Models Implementing Change Initiatives that Support Departments from within,nan,nan,nan,nan,httpsopenbookslibraryumasseduascnti2020chaptergreenhoot-etal,nan,2020-12-15,2024-01-25 221439,2024-04-25 170935,2024-01-20 003424,nan,nan,nan,nan,nan,nan,Variations on Embedded Expert Models,nan,nan,nan,nan,nan,nan,en,nan,nan,nan,nan,openbookslibraryumassedu,nan,Book Title Transforming Institutions Accelerating Systemic Change in Higher Education Publisher Pressbooks,nan,UsersivancheungZoterostorage9AM5WABDgreenhoot-etalhtml,nan,Professional Development; Science Centre for Learning and Teaching Skylight,nan,nan,nan,nan,nan,nan,nan,nan,nan,nan,nan,nan,nan,nan,nan,nan,nan,nan,nan,nan,nan,nan,nan,nan,nan,nan,nan,nan,nan,nan,nan,nan,nan,nan,nan,nan,nan,nan,nan,nan,nan,nan,nan,nan,nan,nan,nan
NBCXJGUR,conferencePaper,2002,"Birol, Gülnur; Budzynski, Ewa; Crosson, Lori; Fahrenbach, John; Gonzalez, Melissa; McKenna, Ann; Smith, J",Creating Learning Challenges on Microbial Kinetics for Biotechnology Education,Proceedings of the ASEE ILIN Sectional Conference,nan,nan,nan,httpsscholargooglecomscholarcluster7951275343581927795hlenoischolarr,nan,2002,2024-01-25 221439,2024-02-02 192420,2024-01-25 001051,5860,nan,nan,nan,nan,nan,nan,nan,nan,nan,nan,nan,nan,nan,nan,nan,nan,nan,Google Scholar,nan,nan,nan,nan,nan,Science Centre for Learning and Teaching Skylight,nan,nan,nan,nan,nan,nan,nan,nan,nan,nan,nan,nan,nan,nan,nan,nan,nan,nan,nan,nan,nan,nan,nan,nan,nan,nan,nan,nan,nan,nan,nan,nan,nan,nan,nan,nan,nan,nan,nan,nan,nan,nan,nan,nan,nan,nan,nan
