Key,Item Type,Publication Year,Author,Title,Publication Title,ISBN,ISSN,DOI,Url,Abstract Note,Date,Date Added,Date Modified,Access Date,Pages,Num Pages,Issue,Volume,Number Of Volumes,Journal Abbreviation,Short Title,Series,Series Number,Series Text,Series Title,Publisher,Place,Language,Rights,Type,Archive,Archive Location,Library Catalog,Call Number,Extra,Notes,File Attachments,Link Attachments,Manual Tags,Automatic Tags,Editor,Series Editor,Translator,Contributor,Attorney Agent,Book Author,Cast Member,Commenter,Composer,Cosponsor,Counsel,Interviewer,Producer,Recipient,Reviewed Author,Scriptwriter,Words By,Guest,Number,Edition,Running Time,Scale,Medium,Artwork Size,Filing Date,Application Number,Assignee,Issuing Authority,Country,Meeting Name,Conference Name,Court,References,Reporter,Legal Status,Priority Numbers,Programming Language,Version,System,Code,Code Number,Section,Session,Committee,History,Legislative Body
VWLQD8VI,conferencePaper,2015,"Fagen-Ulmschneider, Wade; Heeren, Cinda; Herman, Geoffrey L; West, Matthew",Re-engineering an Introduction to Computing Course within a College-Wide Community of Practice,nan,978-0-692-50180-1,nan,nan,httpspeeraseeorgre-engineering-an-introduction-to-computing-course-within-a-college-wide-community-of-practice,"Reengineering an Introduction to Computing course within a College-Wide Community of Practice Widening Implementation  Demonstration of Evidence Based Reforms WIDER is acampus-wide effort to create institutional change in the way we teach core gateway STEMcourses While instruction and course reform has historically been attempted by lone rangers tolittle lasting effect, WIDERs paradigm is to organize instructors into Communities of PracticeCoPs to provide mutual support and training, and to encourage and facilitate the organicdissemination of best practices across courses among the members of the community of practiceIn particular, mentorship relationships within the community have provided ready avenues forthe translation of best practices In the full paper, we will describe and analyze the redesign ofone such course in the WIDER community, highlighting how the redesign of this course wasinformed by its involvement within this larger community of practice Collectively, faculty in all disciplines have rapidly increasing expectations for studentscompetencies in computing In response, our Introduction to Computing course wasreengineered during the Spring 2014 semester with a three-pronged vision 1 maintaining andelevating student engagement, 2 scaling the course to thousands of students per year, and 3extending accessibility to any student, regardless of major, background knowledge, or technicalability To elevate student engagement, the course iterates through nine instructional cyclesconsisting of four elements a pre-lecture content presentation and practice problems, b activelearning exercise during in-class lectures, c collaborative, context-rich problem solving labsections, and d a programming assignment to complete on their own These elements wereinitially developed in other courses redesigned by other members of the WIDER community,providing inspiration and guidance from within the community of practice Efforts to scale this course have relied on the flipped course model and tapping into theone resource that scales with the number of students in the course undergraduate courseassistants In particular, the collaborative lab sections are staffed primarily by former students Finally, to improve accessibility, the course content is being designed with a mobile-first approach, ensuring that assignments, including assignments that involved writing code,could be completed on any modern computing device regardless of size As part of the implement-evaluate culture engendered by the WIDER community, wehave collected a variety of data demonstrating the effectiveness of this new course designSurveys have revealed that students are responding positively to the collaborative learningenvironment as 83 of students report that their peers are helpful in lab and 87 prefer workingin groups to working individually Similarly, pageview data shows that students are investingtime in the pre-lecture activities and are taking advantage of the mobile-first design The success of the reengineering has seen the course enrollment jump to over 900students in Fall 2014 In the spirit of WIDER, the community is now translating these practicesto a follow-on Foundations in Computing course at the sophomore level This new course isexpected to be executed in Spring 2015 using the same course design and teaching techniqueswithin the WIDER community of practice",2015-06-14,2024-01-25 221439,2024-02-22 005031,2023-12-05 221935,2613031-2613039,nan,nan,nan,nan,nan,nan,nan,nan,nan,nan,nan,nan,nan,nan,nan,nan,nan,peeraseeorg,nan,ISSN 2153-5965,nan,UsersivancheungZoterostorage3AE6URLBFagen-Ulmschneider et al - 2015 - Re-engineering an Introduction to Computing Courpdf,nan,Computer Science; Engagement; Introductory Courses; Active Learning; Professional Development; First Year; Pre-UBC Tenure; Course Development,nan,nan,nan,nan,nan,nan,nan,nan,nan,nan,nan,nan,nan,nan,nan,nan,nan,nan,nan,nan,nan,nan,nan,nan,nan,nan,nan,nan,nan,nan,nan,2015 ASEE Annual Conference  Exposition,nan,nan,nan,nan,nan,nan,nan,nan,nan,nan,nan,nan,nan,nan,nan
SMESR6DP,conferencePaper,2015,"Heeren, Cinda; Fagen-Ulmschneider, Wade",Quantitative Correlation between Student Use of Office Hours and Course Performance,nan,978-0-692-50180-1,nan,nan,httpspeeraseeorgquantitative-correlation-between-student-use-of-office-hours-and-course-performance,"Quantitative Correlation between Student Use of Office Hours and Course Performance University courses with a significant computing component typically provide support forstudent learning in the form of open lab hours attended by instructional staff Students visit theopen lab to work on computer-based assignments, and staff address questions as they arise,thereby providing just-in-time instruction and removing barriers to student progress We havedeveloped an online queuing system that we use to schedule student assistance in many of ourcore computing courses While electronic queuing systems have been used in computing labs fordecades, our web tool is instrumented to record a complete historical log of interaction timesbetween students and staff The analysis presented in this paper is our attempt to understandwho uses the open labs, and what benefit, if any, they receive by doing so Though we have recorded data over five consecutive semesters in three large classes, ourpreliminary analysis addresses a single semester Spring, 2014 in a 500-student CS2 course Inthis paper we examine queue use patterns in the context of regular assignment due dates, and wecorrelate staff-student interactions with student scores on exams and on programming projectsMost notably, we find 1 student use of the lab resources accelerates near due dates surprise,2 student use of staffed lab hours follows the 80-20 rule where 80 of the staff time is spentanswering questions from 20 of the students, 3 the 10 of students who use office hoursmost frequently perform significantly better on programming assignments 825 to 895 points,p0005 and generally better on exams 721 to 747 points, p0104 than the other students inthe course, and 4 students making only limited use of office hours five or fewer questions persemester see no statistically significant improvement in their course assessments The full paper presents a multi-semester, cross-course quantitative analysis of student useof open lab assistance in programming-based CS courses, including correlation with courseperformance We continue to use the online queue system in our courses and we are using theresults of the analysis to deploy staff resources more effectively and to adapt course policy to thereality of student study behaviors",2015-06-14,2024-01-25 221439,2024-02-22 005015,2023-12-05 221844,2612961-2612969,nan,nan,nan,nan,nan,nan,nan,nan,nan,nan,nan,nan,nan,nan,nan,nan,nan,peeraseeorg,nan,ISSN 2153-5965,nan,UsersivancheungZoterostorageI5SXAQKPHeeren and Fagen-Ulmschneider - 2015 - Quantitative Correlation between Student Use of Ofpdf,nan,Computer Science; Student Performance; Teaching Resources Digital Other; Pre-UBC Tenure; Exams,nan,nan,nan,nan,nan,nan,nan,nan,nan,nan,nan,nan,nan,nan,nan,nan,nan,nan,nan,nan,nan,nan,nan,nan,nan,nan,nan,nan,nan,nan,nan,2015 ASEE Annual Conference  Exposition,nan,nan,nan,nan,nan,nan,nan,nan,nan,nan,nan,nan,nan,nan,nan
ZX96F22V,conferencePaper,2008,"Goldman, Ken; Gross, Paul; Heeren, Cinda; Herman, Geoffrey; Kaczmarczyk, Lisa; Loui, Michael C; Zilles, Craig",Identifying important and difficult concepts in introductory computing courses using a delphi process,Proceedings of the 39th SIGCSE technical symposium on Computer science education,978-1-59593-799-5,nan,10114513521351352226,httpsdoiorg10114513521351352226,"A Delphi process is a structured multi-step process that uses a group of experts to achieve a consensus opinion We present the results of three Delphi processes to identify topics that are important and difficult in each of three introductory computing subjects discrete math, programming fundamentals, and logic design The topic rankings can be used to guide both the coverage of standardized tests of student learning ie, concept inventories and can be used by instructors to identify what topics merit emphasis",2008-03-12,2024-01-25 221439,2024-02-22 004932,2023-12-05,256260,nan,nan,nan,nan,nan,nan,SIGCSE '08,nan,nan,nan,Association for Computing Machinery,"New York, NY, USA",nan,nan,nan,nan,nan,ACM Digital Library,nan,nan,nan,UsersivancheungZoterostorage4AYTZVUDGoldman et al - 2008 - Identifying important and difficult concepts in inpdf,nan,Computer Science; Mathematics; Concept Inventory; Introductory Courses; Curriculum Review; Pre-UBC Tenure,nan,nan,nan,nan,nan,nan,nan,nan,nan,nan,nan,nan,nan,nan,nan,nan,nan,nan,nan,nan,nan,nan,nan,nan,nan,nan,nan,nan,nan,nan,nan,nan,nan,nan,nan,nan,nan,nan,nan,nan,nan,nan,nan,nan,nan,nan,nan
WAJRADNL,conferencePaper,2006,"Almstrum, Vicki L; Henderson, Peter B; Harvey, Valerie; Heeren, Cinda; Marion, William; Riedesel, Charles; Soh, Leen-Kiat; Tew, Allison Elliott",Concept inventories in computer science for the topic discrete mathematics,Working group reports on ITiCSE on Innovation and technology in computer science education,978-1-59593-603-5,nan,10114511892151189182,httpsdoiorg10114511892151189182,"This report describes concept inventories, specialized assessment instruments that enable educational researchers to investigate student misunderstandings of concepts in a particular domain While students experience a concept inventory as a set of multiple-choice items taken as a test, this belies its purpose, its careful development, and its validation A concept inventory is not intended to be a comprehensive instrument, but rather a tool that probes student comprehension of a carefully selected subset of concepts that give rise to the most common and pervasive mismodelings The report explains how concept inventories have been developed and used in other STEM fields, then outlines a project to explore the feasibility of concept inventories in the computing field We use the domain of discrete mathematics to illustrate a suggested plan of action",2006-06-26,2024-01-25 221439,2024-02-22 004827,2023-12-05,132145,nan,nan,nan,nan,nan,nan,ITiCSE-WGR '06,nan,nan,nan,Association for Computing Machinery,"New York, NY, USA",nan,nan,nan,nan,nan,ACM Digital Library,nan,nan,nan,nan,nan,Computer Science; Mathematics; Concept Inventory; Assessment; Assessment Tools; Misconceptions; Pre-UBC Tenure,nan,nan,nan,nan,nan,nan,nan,nan,nan,nan,nan,nan,nan,nan,nan,nan,nan,nan,nan,nan,nan,nan,nan,nan,nan,nan,nan,nan,nan,nan,nan,nan,nan,nan,nan,nan,nan,nan,nan,nan,nan,nan,nan,nan,nan,nan,nan
2WJAN9S9,conferencePaper,2011,"Meyer, Charlie; Heeren, Cinda; Shaffer, Eric; Tedesco, Jon",CoMoTo the collaboration modeling toolkit,Proceedings of the 16th annual joint conference on Innovation and technology in computer science education,978-1-4503-0697-3,nan,10114519997471999789,httpsdoiorg10114519997471999789,"We are excited to introduce CoMoTo -- the Collaboration Modeling Toolkit -- a new, web-based application that expands and enhances well-known software similarity detection systems CoMoTo is an end-to-end data management, analysis, and visualization system whose purpose is to assist instructors of courses requiring programming exercises to monitor and investigate the extent of student collaboration, both allowed and illicit We describe CoMoTo's interface, which was designed to facilitate scrutiny of collaboration data projected along student, course, assignment, etc attributes, and to allow for interactive visualization of pairwise similarity measures via a dynamic graph We also elaborate on the details of CoMoTo's implementation Finally, we briefly discuss two use cases that foreshadow CoMoTo's broad utility in student code analysis, not only for plagiarism detection, but also for investigating early student coding styles, and for evaluating software similarity detection systems, themselves",2011-06-27,2024-01-25 221439,2024-02-22 004817,2023-12-05,143147,nan,nan,nan,nan,nan,CoMoTo,ITiCSE '11,nan,nan,nan,Association for Computing Machinery,"New York, NY, USA",nan,nan,nan,nan,nan,ACM Digital Library,nan,nan,nan,nan,nan,Computer Science; Data Visualization; Student Modeling; Teaching Resources Digital Other; Group Work; Pre-UBC Tenure,nan,nan,nan,nan,nan,nan,nan,nan,nan,nan,nan,nan,nan,nan,nan,nan,nan,nan,nan,nan,nan,nan,nan,nan,nan,nan,nan,nan,nan,nan,nan,nan,nan,nan,nan,nan,nan,nan,nan,nan,nan,nan,nan,nan,nan,nan,nan
NVLCE2JM,journalArticle,2016,"Oehlman, Natasha; Haegar, Heather; Clarkston, Bridgette; Banks, John E",Maximizing the Function of Student Eportfolios,nan,nan,1541-1389,nan,httpswwwproquestcomdocview1826255017sourcetypeScholarly20Journals,"UNDERGRADUATE RESEARCH EPORTFOLIOS Undergraduate research is well documented as a high-impact process Kinzie et al 2008 and is tied to a number of positive student outcomes, particularly for traditionally underrepresented students Cole and Espinoza 2008 In addition to students' appraisal of their learning, the AACU Integrative Learning VALUE Rubric was used to assess five distinct criteria  l connections to experience, 2 connection to discipline, 3 transfer of learning, 4 integrated communication, and 5 reflection and self-assessment",2016,2024-01-25 221414,2024-04-24 184147,nan,13,nan,3,180,nan,nan,nan,nan,nan,nan,nan,nan,nan,English,nan,nan,nan,nan,nan,nan,nan,nan,nan,nan,Biology; Pre-UBC Tenure; Research Experience; Student Satisfaction; Undergraduate Students,nan,nan,nan,nan,nan,nan,nan,nan,nan,nan,nan,nan,nan,nan,nan,nan,nan,nan,nan,nan,nan,nan,nan,nan,nan,nan,nan,nan,nan,nan,nan,nan,nan,nan,nan,nan,nan,nan,nan,nan,nan,nan,nan,nan,nan,nan,nan
4EDXK8ZT,journalArticle,2019,"Waked, Alexander E; Demmans, Karl Z; Hems, Rachel F; Reyes, Laura M; Mallov, Ian; Daley, Erika; Hoch, Laura B; Mastronardi, Melanie L; De La Franier, Brian J; Borduas-Dedekind, Nadine; Dicks, Andrew P",The Green Chemistry Initiatives contributions to education at the University of Toronto and beyond,Green Chemistry Letters and Reviews,nan,1751-8253,1010801751825320191609597,httpsdoiorg1010801751825320191609597,"The Green Chemistry Initiative GCI is a student-led group founded in 2012 with the primary mission of promoting green chemistry education at the University of Toronto In order to achieve this, the GCIs activities have included undergraduate curriculum development, arrangement of an external speaker seminar series, and organization of an annual three-day symposium along with biweekly trivia challenges To broaden education beyond the Department of Chemistry, a successful YouTube video campaign articulating the Twelve Principles of Green Chemistry in an accessible manner has also been undertaken acquiring over 40,000 views, in addition to monthly blog posts and conferenceoutreach presentations Descriptions of these activities are discussed in this paper, along with the resulting impact they have had Through such efforts, undergraduate and graduate students are showing a growing understanding of the relevance of green chemistry in todays world, with the GCI serving as a platform for similar groups to build upon across Canada",2019-04-03,2024-01-25 221439,2024-02-22 003426,2023-12-05 000359,187-195,nan,2,120,nan,nan,nan,nan,nan,nan,nan,nan,nan,nan,nan,nan,nan,nan,Taylor and FrancisNEJM,nan,Publisher Taylor  Francis _eprint httpsdoiorg1010801751825320191609597,nan,UsersivancheungZoterostorageIS9TCSCUWaked et al - 2019 - The Green Chemistry Initiatives contributions to pdf,nan,Undergraduate Students; Teaching Practices; Chemistry; Curriculum Review; Pre-UBC Tenure,nan,nan,nan,nan,nan,nan,nan,nan,nan,nan,nan,nan,nan,nan,nan,nan,nan,nan,nan,nan,nan,nan,nan,nan,nan,nan,nan,nan,nan,nan,nan,nan,nan,nan,nan,nan,nan,nan,nan,nan,nan,nan,nan,nan,nan,nan,nan
DTAZFFU8,journalArticle,2019,"Obhi, Nimrat K; Mallov, Ian; Borduas-Dedekind, Nadine; Rousseaux, Sophie A L; Dicks, Andrew P",Comparing Industrial Amination Reactions in a Combined Class and Laboratory Green Chemistry Assignment,Journal of Chemical Education,nan,0021-9584,101021acsjchemed8b00578,httpsdoiorg101021acsjchemed8b00578,"This article describes a comparative assignment developed for a third-year undergraduate organic synthesis course involving a combined laboratory experiment and class exercise In this assignment, students compare the sustainability of two industrial amination reactions to form the same target molecule 4-n-hexylaminobenzonitrile a nucleophilic aromatic substitution procedure SNAr provided in the class exercise, and a BuchwaldHartwig BH amination procedure completed in the laboratory The assignment is structured using a case-study format to provide appropriate context Students use industrial solvent and reagent substitution guides, complete process mass intensity calculations, and apply the Twelve Principles of Green Chemistry to compare and contrast the SNAr and BH reactions They finally recommend a preferred reaction procedure after considering multiple sustainability concepts in their analyses The assignment is highly adaptable as different industry guides may be used and the SNAr reaction procedure is easily modified Ultimately, students learn to apply sustainable chemistry principles to industrially relevant reactions, an important skill for their future careers",2019-01-08,2024-01-25 221439,2024-02-22 003404,2023-12-05 000215,93-99,nan,1,960,nan,J Chem Educ,nan,nan,nan,nan,nan,nan,nan,nan,nan,nan,nan,nan,ACS Publications,nan,Publisher American Chemical Society,nan,nan,nan,Chemistry; Teaching Resources Digital Other; Student Satisfaction; Pre-UBC Tenure; Sustainability,nan,nan,nan,nan,nan,nan,nan,nan,nan,nan,nan,nan,nan,nan,nan,nan,nan,nan,nan,nan,nan,nan,nan,nan,nan,nan,nan,nan,nan,nan,nan,nan,nan,nan,nan,nan,nan,nan,nan,nan,nan,nan,nan,nan,nan,nan,nan
SEZXVUKL,journalArticle,2016,"Deane, Thomas; Nomme, Kathy; Jeffery, Erica; Pollock, Carol; Birol, Gülnur",Development of the Statistical Reasoning in Biology Concept Inventory SRBCI,CBE life sciences education,nan,1931-7913,101187cbe15-06-0131,nan,"We followed established best practices in concept inventory design and developed a 12-item inventory to assess student ability in statistical reasoning in biology Statistical Reasoning in Biology Concept Inventory SRBCI It is important to assess student thinking in this conceptual area, because it is a fundamental requirement of being statistically literate and associated skills are needed in almost all walks of life Despite this, previous work shows that non-expert-like thinking in statistical reasoning is common, even after instruction As science educators, our goal should be to move students along a novice-to-expert spectrum, which could be achieved with growing experience in statistical reasoning We used item response theory analyses the one-parameter Rasch model and associated analyses to assess responses gathered from biology students in two populations at a large research university in Canada in order to test SRBCI's robustness and sensitivity in capturing useful data relating to the students' conceptual ability in statistical reasoning Our analyses indicated that SRBCI is a unidimensional construct, with items that vary widely in difficulty and provide useful information about such student ability SRBCI should be useful as a diagnostic tool in a variety of biology settings and as a means of measuring the success of teaching interventions designed to improve statistical reasoning skills",2016,2024-01-25 221414,2024-02-15 221923,nan,ar5,nan,1,150,nan,nan,nan,nan,nan,nan,nan,nan,nan,English,nan,nan,nan,nan,nan,nan,nan,nan,UsersivancheungZoterostorage33IXWJEADeane et al - 2016 - Development of the Statistical Reasoning in Biologpdf,nan,Concept Inventory; Biology; Assessment; Misconceptions; Science Centre for Learning and Teaching Skylight,nan,nan,nan,nan,nan,nan,nan,nan,nan,nan,nan,nan,nan,nan,nan,nan,nan,nan,nan,nan,nan,nan,nan,nan,nan,nan,nan,nan,nan,nan,nan,nan,nan,nan,nan,nan,nan,nan,nan,nan,nan,nan,nan,nan,nan,nan,nan
M6RFMI2Y,journalArticle,2014,"Deane, Thomas; Nomme, Kathy; Jeffery, Erica; Pollock, Carol; Birol, Gülnur",Development of the Biological Experimental Design Concept Inventory BEDCI,CBE Life Sciences Education,nan,1931-7913,101187cbe13-11-0218,nan,"Interest in student conception of experimentation inspired the development of a fully validated 14-question inventory on experimental design in biology BEDCI by following established best practices in concept inventory CI design This CI can be used to diagnose specific examples of non-expert-like thinking in students and to evaluate the success of teaching strategies that target conceptual changes We used BEDCI to diagnose non-expert-like student thinking in experimental design at the pre- and posttest stage in five courses total n  580 students at a large research university in western Canada Calculated difficulty and discrimination metrics indicated that BEDCI questions are able to effectively capture learning changes at the undergraduate level A high correlation r  084 between responses by students in similar courses and at the same stage of their academic career, also suggests that the test is reliable Students showed significant positive learning changes by the posttest stage, but some non-expert-like responses were widespread and persistent BEDCI is a reliable and valid diagnostic tool that can be used in a variety of life sciences disciplines",2014,2024-01-25 221414,2024-03-09 002007,nan,540-551,nan,3,130,nan,nan,nan,nan,nan,nan,nan,nan,nan,English,nan,nan,nan,nan,nan,nan,nan,nan,UsersivancheungZoterostorageMD9RPA6Wcbehtml; UsersivancheungZoterostorageHBVWUAJJDeane et al - 2014 - Development of the Biological Experimental Design pdf,nan,Concept Inventory; Assessment; Misconceptions; Science Centre for Learning and Teaching Skylight,nan,nan,nan,nan,nan,nan,nan,nan,nan,nan,nan,nan,nan,nan,nan,nan,nan,nan,nan,nan,nan,nan,nan,nan,nan,nan,nan,nan,nan,nan,nan,nan,nan,nan,nan,nan,nan,nan,nan,nan,nan,nan,nan,nan,nan,nan,nan
5ZF4J32P,journalArticle,2007,"Birol, Gulnur; McKenna, Ann F; Smith, David H; Giorgio, Todd D; Brophy, Sean",Development of Challenge-Based Educational Modules in the Biotechnology Domain,International Journal of Engineering Education,nan,0949-149X,nan,httpswwwresearchgatenetpublication233577330_Development_of_Challenge-Based_Educational_Modules_in_the_Biotechnology_Domain,"Biotechnology is one of the active domains in the NSF funded Engineering Research Center VaNTH Vanderbilt, Northwestern, University of Texas, and HarvardMIT where educational modules have been developed These modules cover a collection of challenges designed around bioreactors, mass and momentum transfer issues, microbial kinetics, and downstream processing, which are among core biotechnology topics The aim of this study was to design educational modules centered on challenge-based education and to implement them in classroom settings This paper focuses on the design and implementation of such educational modules and provides an overview of the challenges and learning activities that were developed for three specific topics that have been implemented at Northwestern and Vanderbilt Universities",2007,2024-01-25 221414,2024-04-24 195007,nan,171-183,nan,1,230,nan,nan,nan,nan,nan,nan,nan,nan,nan,English,nan,nan,nan,nan,nan,nan,nan,nan,nan,nan,Assessment; Biotechnology; Concept Inventory; Science Centre for Learning and Teaching Skylight,nan,nan,nan,nan,nan,nan,nan,nan,nan,nan,nan,nan,nan,nan,nan,nan,nan,nan,nan,nan,nan,nan,nan,nan,nan,nan,nan,nan,nan,nan,nan,nan,nan,nan,nan,nan,nan,nan,nan,nan,nan,nan,nan,nan,nan,nan,nan
