Key,Item Type,Publication Year,Author,Title,Publication Title,ISBN,ISSN,DOI,Url,Abstract Note,Date,Date Added,Date Modified,Access Date,Pages,Num Pages,Issue,Volume,Number Of Volumes,Journal Abbreviation,Short Title,Series,Series Number,Series Text,Series Title,Publisher,Place,Language,Rights,Type,Archive,Archive Location,Library Catalog,Call Number,Extra,Notes,File Attachments,Link Attachments,Manual Tags,Automatic Tags,Editor,Series Editor,Translator,Contributor,Attorney Agent,Book Author,Cast Member,Commenter,Composer,Cosponsor,Counsel,Interviewer,Producer,Recipient,Reviewed Author,Scriptwriter,Words By,Guest,Number,Edition,Running Time,Scale,Medium,Artwork Size,Filing Date,Application Number,Assignee,Issuing Authority,Country,Meeting Name,Conference Name,Court,References,Reporter,Legal Status,Priority Numbers,Programming Language,Version,System,Code,Code Number,Section,Session,Committee,History,Legislative Body
MF95DALJ,journalArticle,2012,"Dryden, Neil; Leander, Celeste; Louis-Martinez, Domingo; Nakahara, Hiroko; MacLean, Mark; Waltham, Chris",Are We Doing Any Good A Value-Added Analysis of UBC's Science One Program,The Canadian Journal for the Scholarship of Teaching and Learning,nan,1918-2902,105206cjsotl-rcacea201224,nan,"Science One is a full academic year interdisciplinary alternative to the traditional first-year experience in the Faculty of Science at the University of British Columbia UBC Anecdotal reports suggest that alumniae of the program do very well in upper-level classes and many become successful graduate and medical students The high facultystudent ratio makes the program an expensive one, however, and thus we have sought rigorous evidence of the benefits to our students Our approach has been a value-added one; we have compared high-school and upper-level undergraduate grades for students in all UBC's first-year science programs We have found a clear signal that there is a large benefit to participating in Science One, and conclude that this arises from a combination of the recruitment of enthusiastic students who are up for a challenge, the Science One admissions process, and taking the program itself",2012,2024-01-25 221414,2024-02-14 234942,nan,nan,nan,2,30,nan,nan,nan,nan,nan,nan,nan,nan,nan,English,nan,nan,nan,nan,nan,nan,nan,nan,nan,nan,Computer Science; Mathematics; Scholarship of Teaching and Learning; Physics and Astronomy; Student Performance; Student Satisfaction; First Year; Upper Year,nan,nan,nan,nan,nan,nan,nan,nan,nan,nan,nan,nan,nan,nan,nan,nan,nan,nan,nan,nan,nan,nan,nan,nan,nan,nan,nan,nan,nan,nan,nan,nan,nan,nan,nan,nan,nan,nan,nan,nan,nan,nan,nan,nan,nan,nan,nan
7XA5LECU,journalArticle,2019,"Knox, Kerry J; Gillis, Elizabeth A L; Dake, Gregory R",A positive student experience of collaborative project work in upper-year undergraduate chemistry,CHEMISTRY EDUCATION RESEARCH AND PRACTICE,nan,1109-4028,101039c8rp00251g,nan,"Demands are placed on undergraduate courses in chemistry to develop transferable skills, such as teamwork, alongside subject content and technical skills Such skills can be developed by implementing pedagogies which involve students working together Such pedagogies can, however, pose various challenges, including unfavourable student perceptions and experiences including the occurrence of dysfunctional student teams This article presents a research-informed group project assignment delivered as part of an upper-year undergraduate chemistry course which has been found to overcome these challenges The instructional activity is characterized by a high degree of structure and support for teamwork Student perceptions, collected by survey and interview, and peer- and self-evaluations of contributions to the work of the groups reveal that students have experienced the activity positively Many perceived disadvantages of working in a team to complete a project were either reportedly not experienced or could be overcome by the students, while perceived advantages were often reported to be experienced Dysfunction within teams did not represent a significant issue",2019,2024-01-25 221414,2024-02-14 234940,nan,34-357,nan,2,20,nan,nan,nan,nan,nan,nan,nan,nan,nan,English,nan,nan,nan,nan,nan,nan,nan,nan,UsersivancheungZoterostorageHTAUTQ58Knox et al - 2019 - A positive student experience of collaborative propdf,nan,Undergraduate Students; Peer Assessment; Chemistry; Survey; Group Work; Teaching Resources Non-Digital; Upper Year,nan,nan,nan,nan,nan,nan,nan,nan,nan,nan,nan,nan,nan,nan,nan,nan,nan,nan,nan,nan,nan,nan,nan,nan,nan,nan,nan,nan,nan,nan,nan,nan,nan,nan,nan,nan,nan,nan,nan,nan,nan,nan,nan,nan,nan,nan,nan
KBGTF3ET,journalArticle,2021,"Prat, Alain; Code, Warren J",WeBWorK log files as a rich source of data on student homework behaviours,International Journal of Mathematical Education in Science and Technology,nan,0020-739X,1010800020739X20201782492,httpsdoiorg1010800020739X20201782492,"The online homework system WeBWorK has been successfully used at several hundred colleges and universities Despite its popularity, the WeBWorK system does not provide detailed metrics of student performance to instructors In this article, we illustrate how an analysis of the log files of the WeBWorK system can provide information such as the amount of time students spend on WeBWorK assignments and how long they persist on problems We estimate the time spent on an assignment by combining log file events into sessions of student activity The validity of this method is confirmed by cross referencing with another time estimate obtained from a learning management system As an application of these performance metrics, we contrast the behaviour of students with WeBWorK scores less than 50 with the remainder of the class in a first year Calculus course This reveals that on average, the students who perform poorly on their homework start later, have shorter activity sessions, and are less persistent when solving problems We conclude by discussing the implications of WeBWorK analytics for instructional practices and for the future of learning analytics in undergraduate mathematics education",2021-11-26,2024-01-25 221439,2024-02-14 234916,2024-01-20 003407,1540-1556,nan,10,520,nan,nan,nan,nan,nan,nan,nan,nan,nan,nan,nan,nan,nan,nan,Taylor and FrancisNEJM,nan,Publisher Taylor  Francis _eprint httpsdoiorg1010800020739X20201782492,nan,UsersivancheungZoterostorageJDRXAV8YPrat and Code - 2021 - WeBWorK log files as a rich source of data on studpdf,nan,Mathematics; Teaching Resources Digital Other; Science Centre for Learning and Teaching Skylight; Analytics; Online Learning; First Year,nan,nan,nan,nan,nan,nan,nan,nan,nan,nan,nan,nan,nan,nan,nan,nan,nan,nan,nan,nan,nan,nan,nan,nan,nan,nan,nan,nan,nan,nan,nan,nan,nan,nan,nan,nan,nan,nan,nan,nan,nan,nan,nan,nan,nan,nan,nan
3G5QQUVT,conferencePaper,2023,"Ola, Oluwakemi",Using Near-Peer Interviews to Support English Language Learners,Proceedings of the 54th ACM Technical Symposium on Computer Science Education V 1,978-1-4503-9431-4,nan,10114535459453569868,httpsdoiorg10114535459453569868,"International students from non-English speaking countries confront various challenges when seeking a degree at an English-speaking institution Some of these challenges relate to the language of instruction, adapting to the norms of a new culture, and the academic program's structure Learning is a cognitive, social, and emotional activity mediated by activities outside of the lecture hall Therefore, exploring students' academic beliefs about belonging and how learning works is essential This report explores how viewing interview clips of second and third-year students can increase first-year students' confidence and sense of belonging and motivate them to engage in effective study practices The feedback indicates that viewing the interviews positively impacted their confidence, sense of belonging, and understanding of how to succeed in the course This report details our experience incorporating the interviews into the course, reflects on the feedback students provided, and presents considerations for faculty seeking to use interviews to impact their students' beliefs",2023-03-03,2024-01-25 221439,2024-02-14 234912,2023-12-06,952958,nan,nan,nan,nan,nan,nan,SIGCSE 2023,nan,nan,nan,Association for Computing Machinery,"New York, NY, USA",nan,nan,nan,nan,nan,ACM Digital Library,nan,nan,nan,nan,nan,Computer Science; International Students; Teaching Resources Video; Online Learning; Belonging; First Year,nan,nan,nan,nan,nan,nan,nan,nan,nan,nan,nan,nan,nan,nan,nan,nan,nan,nan,nan,nan,nan,nan,nan,nan,nan,nan,nan,nan,nan,nan,nan,nan,nan,nan,nan,nan,nan,nan,nan,nan,nan,nan,nan,nan,nan,nan,nan
W68QQFU7,journalArticle,2019,"Mochetti, Karina; Souza, João Pedro Abreu de; Santos, Carlos Henrique D C",Using Active Learning to Teach Unix Commands,Anais do Computer on the Beach,nan,2358-0852,nan,httpsperiodicosunivalibrindexphpacotbarticleview14407,"Abstract Nowadays, it is vital for a computer scientist to be prepared for dif- ferent environments such as new frameworks, different programming paradigms and multiple operational systems Unfortunately, it is common that freshman students are only used to Microsoft Windows Operating System and no proper class or activity is done to revert that Therefore, our goal is to teach minimal Unix-like skills to first year students through a challenge-based learning ap- proach To this end, we will use a list of quests with ascendant difficulty levels, without no functionality to reinforce competition between students Its interface is all web-based with a colored shell looking, so students can get used to Unix command line environment and slowly loose their distrust in a different opera- tional system",2019-05-29,2024-01-25 221439,2024-02-14 234907,2023-12-06 182458,781-783,nan,nan,nan,nan,nan,nan,nan,nan,nan,nan,nan,nan,pt,Copyright c 2019 Anais do Computer on the Beach,nan,nan,nan,periodicosunivalibr,nan,nan,nan,UsersivancheungZoterostorageX336YWF8Mochetti et al - 2019 - Using Active Learning to Teach Unix Commandspdf,nan,Computer Science; Undergraduate Students; Introductory Courses; Active Learning; First Year,nan,nan,nan,nan,nan,nan,nan,nan,nan,nan,nan,nan,nan,nan,nan,nan,nan,nan,nan,nan,nan,nan,nan,nan,nan,nan,nan,nan,nan,nan,nan,nan,nan,nan,nan,nan,nan,nan,nan,nan,nan,nan,nan,nan,nan,nan,nan
RCVA3NGF,journalArticle,2011,"Slaughter, Katherine A; Bates, Simon P; Galloway, Ross K",The Changes in Attitudes and Beliefs of First Year Physics Undergraduates A Study Using the CLASS Survey,International Journal of Innovation in Science and Mathematics Education,nan,nan,nan,httpsopenjournalslibrarysydneyeduauCALarticleview4780,"Personal attitudes and beliefs towards learning can influence the way students approach and study a subject; as a result, evaluation of attitudes and how these change over time is becoming increasingly common We have carried out a study looking at the changes in attitudes of first year physics students over two years at the University of Edinburgh The Colorado Learning Attitudes About Science Survey CLASS was used to obtain a measure of expert-like thinking for students both pre- and post- first year teaching The results have been subdivided to look at the differences between physics majors' and non-majors' as well as the differences in attitudes of female and male students It was found, in line with previous studies, that students' levels of expert-like thinking decline after initial instruction When the data was subdivided to look in more detail at specific sections of the undergraduate class it was seen that the decrease in expert-like thinking is much more marked in non-majors' - those students not intending to take physics as a degree - and also greater in female students than their male peers",2011,2024-01-25 221414,2024-04-24 175123,nan,nan,nan,1,190,nan,nan,nan,nan,nan,nan,nan,nan,nan,English,nan,nan,nan,nan,nan,nan,nan,nan,nan,nan,First Year; Introductory Courses; Physics and Astronomy; Student Attitudes,nan,nan,nan,nan,nan,nan,nan,nan,nan,nan,nan,nan,nan,nan,nan,nan,nan,nan,nan,nan,nan,nan,nan,nan,nan,nan,nan,nan,nan,nan,nan,nan,nan,nan,nan,nan,nan,nan,nan,nan,nan,nan,nan,nan,nan,nan,nan
9BUH529Y,conferencePaper,2023,"Cantin, Ariane; Ashok, Aarthi; Asiedu, Evelyn; Ives, Joss; Summers, Mindi; Stang, Jared; Stewart, Jaclyn; Kelly, Tamara",The Canadian Consortium of Science Equity Scholars  a multi-institutional approach to improving equity and sense of belonging in the classroom,The Western Conference on Science Education,nan,nan,nan,httpsirlibuwocawcseWSCETwentyTwentyThreefri-july-1411,"The Canadian Consortium of Science Equity Scholars CCSES is a multi-institution group of educators and researchers committed to improving equity in post-secondary science education We seek to rectify the dearth of EDI data in a Canadian context to ensure that we have the information we need to understand our students experience and improve teaching practices to support all students Our research focuses on the affective dimensions of the classroom and how students perceive themselves and what helps them develop their identity in STEM To gather information on how students sense of belonging and self-efficacy belief in ones own capacity to succeed is impacted by classroom climate and teaching practices, we are surveying students in biology, chemistry, and physics first-year classes across Canada Data from these surveys will help us identify inequities, but also inclusive teaching practices and the impact they have on different demographic groups In this session, we will present preliminary results from the initial year of data collected at five Canadian universities, and discuss how this research can inform how we structure programs and courses to reduce systemic and structural barriers to student success This session will provide participants with ideas on how to better engage their students and improve their sense of belonging and self-efficacy, but also help build connections within the teaching and learning community to collect data to better understand student experiences across science disciplines and institutions to improve teaching practices This project was approved by the research ethics boards of all the institutions where data were collected",2023-07-14,2024-01-25 221439,2024-04-16 164349,nan,nan,nan,nan,nan,nan,nan,nan,nan,nan,nan,nan,nan,nan,nan,nan,nan,nan,nan,nan,nan,nan,nan,UsersivancheungZoterostorageBCKQQFDT11html,nan,Engagement; Introductory Courses; Physics and Astronomy; Science Centre for Learning and Teaching Skylight; Student Satisfaction; Belonging; First Year,nan,nan,nan,nan,nan,nan,nan,nan,nan,nan,nan,nan,nan,nan,nan,nan,nan,nan,nan,nan,nan,nan,nan,nan,nan,nan,nan,nan,nan,nan,nan,nan,nan,nan,nan,nan,nan,nan,nan,nan,nan,nan,nan,nan,nan,nan,nan
HUIGCT8P,journalArticle,2010,"Day, James; Nakahara, Hiroko; Bonn, Doug",Teaching Standard Deviation by Building from Student Invention,The Physics Teacher,nan,0031-921X,10111913502511,nan,"First-year physics laboratories are often driven by a mix of goals that includes the illustration or discovery of basic physics principles and a myriad of technical skills involving specific equipment, data analysis, and report writing The sheer number of such goals seems guaranteed to produce cognitive overload, even when highly detailed cookbook instructions are given Recent studies indicate that this approach leaves students with a poor conceptual understanding of one of the most important features of laboratory physics and of the real world of science, in general the development of an understanding of the nature of measurement and its attendant uncertainty While students might be able to reproduce certain technical manipulations of data, as novice thinkers they lack the mental scaffolding that allows an expert to organize and apply this knowledge Our goal is to put novices on the path to expertise, so that they will be able to transfer their knowledge to novel situations; First-year physics laboratories are often driven by a mix of goals that includes the illustration or discovery of basic physics principles and a myriad of technical skills involving specific equipment, data analysis, and report writing The sheer number of such goals seems guaranteed to produce cognitive overload, even when highly detailed cookbook instructions are given Recent studies indicate that this approach leaves students with a poor conceptual understanding of one of the most important features of laboratory physics and of the real world of science, in general the development of an understanding of the nature of measurement and its attendant uncertainty1 While students might be able to reproduce certain technical manipulations of data, as novice thinkers they lack the mental scaffolding that allows an expert to organize and apply this knowledge2,3 Our goal is to put novices on the path to expertise, so that they will be able to transfer their knowledge to novel situations",2010,2024-01-25 221414,2024-02-14 234839,nan,546-548,nan,8,480,nan,nan,nan,nan,nan,nan,nan,nan,nan,English,nan,nan,nan,nan,nan,nan,nan,nan,nan,nan,Introductory Courses; Lab Course; Student Performance; First Year,nan,nan,nan,nan,nan,nan,nan,nan,nan,nan,nan,nan,nan,nan,nan,nan,nan,nan,nan,nan,nan,nan,nan,nan,nan,nan,nan,nan,nan,nan,nan,nan,nan,nan,nan,nan,nan,nan,nan,nan,nan,nan,nan,nan,nan,nan,nan
627CMSQC,journalArticle,2023,"Bett, Nolan N; Piccolo, Costanza; Roberson, Nathan D; Charbonneau, A James; Addison, Christopher J",Students Views on the Nature of Science in an Interdisciplinary First-Year Science Program Content Analysis of a Weekly Reflection Activity,Teaching and Learning Inquiry,nan,2167-4787,1020343teachlearninqu1110,httpsjournalhostingucalgarycaindexphpTLIarticleview72883,"A primary aim of science education is to teach students how to interpret and engage with scientific information To do so effectively requires an adequate understanding of the nature of science NOSin other words, what science is and how it works There is a long history of evidence to suggest that many undergraduate students struggle to properly understand NOS While the specific factors contributing to misinformed views on NOS may be difficult to tease apart, the way in which students learn about science at the undergraduate level is a significant contributor We implemented a reflection activity in a unique first-year program at a large Canadian university in order to promote student learning of NOS Through the students reflections, we identified how certain pedagogical approaches, many of which deviate from traditional teaching methods used throughout undergraduate science education, can positively impact student comprehension of NOS Our experiences support the use of reflective practices in promoting critical thinking and the development of more nuanced student views of NOS Click here to read the corresponding ISSOTL blog post",2023-03-14,2024-01-25 221439,2024-02-14 234834,2023-12-20 210206,nan,nan,nan,110,nan,nan,Students Views on the Nature of Science in an Interdisciplinary First-Year Science Program,nan,nan,nan,nan,nan,nan,en,"Copyright c 2023 Nolan N Bett, Costanza Piccolo, Nathan D Roberson, A James Charbonneau, Christopher J Addison",nan,nan,nan,journalhostingucalgaryca,nan,nan,nan,UsersivancheungZoterostorageSE8NZ8QCBett et al - 2023 - Students Views on the Nature of Science in an Intpdf,nan,Mathematics; Undergraduate Students; Teaching Practices; Critical Thinking; Physics and Astronomy; Interdisciplinary; First Year,nan,nan,nan,nan,nan,nan,nan,nan,nan,nan,nan,nan,nan,nan,nan,nan,nan,nan,nan,nan,nan,nan,nan,nan,nan,nan,nan,nan,nan,nan,nan,nan,nan,nan,nan,nan,nan,nan,nan,nan,nan,nan,nan,nan,nan,nan,nan
WASAK2DH,conferencePaper,2023,"McNutt, Julie; Piccolo, Costanza; Massey-Allard, Jonathan",Students perceptions of research projects in a first-year integrated science program,The Western Conference on Science Education,nan,nan,nan,httpsirlibuwocawcseWSCETwentyTwentyThreethurs-july-1331,nan,2023-07-13,2024-01-25 221439,2024-04-16 164305,nan,nan,nan,nan,nan,nan,nan,nan,nan,nan,nan,nan,nan,nan,nan,nan,nan,nan,nan,nan,nan,nan,nan,UsersivancheungZoterostorageCUVN2UTD31html,nan,Mathematics; Introductory Courses; First Year,nan,nan,nan,nan,nan,nan,nan,nan,nan,nan,nan,nan,nan,nan,nan,nan,nan,nan,nan,nan,nan,nan,nan,nan,nan,nan,nan,nan,nan,nan,nan,nan,nan,nan,nan,nan,nan,nan,nan,nan,nan,nan,nan,nan,nan,nan,nan
NPR99YS4,journalArticle,2015,"Lekhi, Priyanka; Nussbaum, Sophia",Strategic Use of Role Playing in a Training Workshop for Chemistry Laboratory Teaching Assistants,The Canadian Journal of Higher Education,nan,0316-1218,nan,httpswwwproquestcomdocview1779441853abstract4BD9F4BC13CA49B6PQ1accountid14656sourcetypeScholarly20Journals," The pre and post questionnaires were analyzed for 2010, 2011, 2012 and 2014 no questionnaire data were collected in 2013 In the first question set, participants were asked to rank their attitudes in different categories ranging from Not at all to Moderately to Extremely For analysis, rankings were grouped into three categories Com- bining rankings was done to increase the number of counts per category for calculating a chi-squared value and to simplify the relationship between the categories Scores of 1 and 2 were grouped into  Not at all, a score of 3 was its own category Moderately, and scores of 4 and 5 were grouped into Extremely For the second question set, participants were asked to rank their level of competency in performing a series of tasks associated with teaching and learning A 5-point scale was used ranging from Beginning; ample guidance needed to Developing; some guidance needed to Exemplary; no guidance needed For analysis, scores of 1 and 2 were grouped into Beginning, a score of 3 was its own category Developing and scores of 4 and 5 were grouped into Exemplary In the written feedback form on Day 1 of the initial workshop, TAs were asked to identify the best part of the day In 2010, the first time we used role plays, 11 out of 38 TAs 29 responded with role playing That same year, nine TAs 24 responded to this question by naming either the session on questioning techniques or the session on teaching techniques, both of which included role playing exercises The other responses included performing the experiment 24, meeting other TAs 10, lunch 8, and group discussions 5 Between 2010 and 2014, the responses to the same question included similar themes with an overall 22 of 159 TAs identifying role playing as the best part of their day If we include the responses that identified a session with a role playing activity, the percentage of participants doubles When prompted to provide an explanation for their choice in the written feedback form, there were two themes connecting knowing the technique to actually using it, and enjoyment Specific responses included role plays brought to light how difficult it is to put these concepts into practice; role playing made me feel like a TA;  role plays was a preview to TAing; and role plays were fun This feedback aligns with the purpose of using role plays in the training as a way to bridge the gap between knowledge of a teaching technique and actually using the technique Moreover, in all the written feedback forms collected in these four years, not one participant included a critical comment about the role play activities in their response to the question asking about how the workshop could be improved We attribute this to a positive training environment that supports role playing activities, an environment created by including the five elements as previously described IS MAD Other studies have highlighted the importance of debriefing role plays and providing explanations before a role play Fadali et al, 2000; Van Ments, 1999 In this setting, when the participants do not know each other prior to the training and are from different backgrounds, it is also key to include icebreakers and to base the role plays on shared experiences; Many Canadian universities have created professional development programs for their teaching assistants TA but may be uncertain about how to bridge the gap between TAs' knowledge of effective teaching strategies and TAs' confident applications of these strategies We present a technique used in a two-day training workshop to enhance graduate students' skills in using effective teaching strategies role playing This paper outlines a framework that includes five key elements Icebreaking, Shared Experiences, Modelling, Acting and Debriefing to strategically design role playing activities in a training program We describe each of the 5 elements and explain how they support training through role play exercises Participant written feedback collected in 2010, 2011, 2012 and 2014 suggested that role playing was a useful and enjoyable technique Pre and post workshop questionnaire data suggested that self-perceived competencies for specified tasks directly connected to a role play activity promoted greater positive differences between the pre and post groups compared to self-perceived competencies for specified tasks not directly connected to a role play activity Based on these results, we assert that training programs which rely on strategic role playing activities will lead to a better overall TA experience of the training program and improvements in TAs' self-perceptions of certain teaching competencies",2015,2024-01-25 221414,2024-04-24 213921,nan,56,nan,3,450,nan,nan,nan,nan,nan,nan,nan,nan,nan,English,nan,nan,nan,nan,nan,nan,nan,nan,nan,httpssearchproquestcomdocview1779441853abstract4BD9F4BC13CA49B6PQ1accountid14656,First Year; Lab Course; Professional Development; Teaching Assistants; Workshops,nan,nan,nan,nan,nan,nan,nan,nan,nan,nan,nan,nan,nan,nan,nan,nan,nan,nan,nan,nan,nan,nan,nan,nan,nan,nan,nan,nan,nan,nan,nan,nan,nan,nan,nan,nan,nan,nan,nan,nan,nan,nan,nan,nan,nan,nan,nan
